[
  {
    "id": "SR-006",
    "title": "Executive decision needed on regional rollout scope",
    "description": "The rollout plan needs a decision on whether Canada is included in the first release. Compliance, support staffing, and launch messaging all depend on the scope decision.",
    "category": "executive_decision",
    "impactScore": 5,
    "urgencyScore": 5,
    "riskScore": 4,
    "dependencyScore": 5,
    "strategicAlignmentScore": 5,
    "confidenceScore": 4,
    "overallImportanceScore": 95,
    "priorityLabel": "Act Now",
    "explanation": "Executive decision needed on regional rollout scope is labeled \"Act Now\" because its strongest drivers are impact, urgency, dependency. Signals include broad customer, revenue, enterprise, billing, or production impact; time-sensitive language or near-term deadline; security, compliance, failure, or downside risk.",
    "recommendedAction": "Escalate the blocker, identify the decision owner, and unblock dependent work today."
  },
  {
    "id": "SR-009",
    "title": "Data retention policy missing for audit export",
    "description": "The audit export feature does not yet document how long exported records are retained. Legal review is pending and enterprise customers have asked for this policy.",
    "category": "compliance",
    "impactScore": 5,
    "urgencyScore": 4,
    "riskScore": 5,
    "dependencyScore": 4,
    "strategicAlignmentScore": 5,
    "confidenceScore": 4,
    "overallImportanceScore": 92,
    "priorityLabel": "Act Now",
    "explanation": "Data retention policy missing for audit export is labeled \"Act Now\" because its strongest drivers are impact, risk, strategic alignment. Signals include broad customer, revenue, enterprise, billing, or production impact; security, compliance, failure, or downside risk; other work, teams, or decisions are blocked.",
    "recommendedAction": "Assign an owner immediately, confirm mitigation steps, and review status today."
  },
  {
    "id": "SR-001",
    "title": "Production checkout failures after payment gateway update",
    "description": "Multiple customers are reporting failed checkout attempts after the payment gateway update. Support has 18 tickets from the last two hours and revenue impact is likely.",
    "category": "production_issue",
    "impactScore": 5,
    "urgencyScore": 5,
    "riskScore": 5,
    "dependencyScore": 3,
    "strategicAlignmentScore": 4,
    "confidenceScore": 5,
    "overallImportanceScore": 91,
    "priorityLabel": "Act Now",
    "explanation": "Production checkout failures after payment gateway update is labeled \"Act Now\" because its strongest drivers are impact, urgency, risk. Signals include broad customer, revenue, enterprise, billing, or production impact; time-sensitive language or near-term deadline; security, compliance, failure, or downside risk.",
    "recommendedAction": "Assign an owner immediately, confirm mitigation steps, and review status today."
  },
  {
    "id": "SR-010",
    "title": "Database migration may slow billing jobs",
    "description": "The planned database migration could increase billing job runtime during the monthly invoice cycle. The infrastructure team recommends a dry run before the next billing window.",
    "category": "operational_risk",
    "impactScore": 5,
    "urgencyScore": 4,
    "riskScore": 5,
    "dependencyScore": 3,
    "strategicAlignmentScore": 4,
    "confidenceScore": 4,
    "overallImportanceScore": 86,
    "priorityLabel": "Act Now",
    "explanation": "Database migration may slow billing jobs is labeled \"Act Now\" because its strongest drivers are impact, risk, urgency. Signals include broad customer, revenue, enterprise, billing, or production impact; security, compliance, failure, or downside risk; specific evidence is present.",
    "recommendedAction": "Assign an owner immediately, confirm mitigation steps, and review status today."
  },
  {
    "id": "SR-011",
    "title": "Customer success needs release notes for new permissions model",
    "description": "Customer success cannot prepare training materials until release notes explain the new permissions model. The launch is next week and several enterprise admins need guidance.",
    "category": "go_to_market",
    "impactScore": 4,
    "urgencyScore": 5,
    "riskScore": 3,
    "dependencyScore": 5,
    "strategicAlignmentScore": 5,
    "confidenceScore": 4,
    "overallImportanceScore": 86,
    "priorityLabel": "Act Now",
    "explanation": "Customer success needs release notes for new permissions model is labeled \"Act Now\" because its strongest drivers are urgency, dependency, strategic alignment. Signals include broad customer, revenue, enterprise, billing, or production impact; time-sensitive language or near-term deadline; other work, teams, or decisions are blocked.",
    "recommendedAction": "Escalate the blocker, identify the decision owner, and unblock dependent work today."
  },
  {
    "id": "SR-003",
    "title": "Analytics vendor API delay blocks launch reporting",
    "description": "The analytics vendor has delayed delivery of the campaign attribution API. Launch reporting depends on this data and the marketing release is scheduled for Friday.",
    "category": "delayed_dependency",
    "impactScore": 3,
    "urgencyScore": 5,
    "riskScore": 3,
    "dependencyScore": 5,
    "strategicAlignmentScore": 5,
    "confidenceScore": 5,
    "overallImportanceScore": 82,
    "priorityLabel": "Act Now",
    "explanation": "Analytics vendor API delay blocks launch reporting is labeled \"Act Now\" because its strongest drivers are urgency, dependency, strategic alignment. Signals include time-sensitive language or near-term deadline; other work, teams, or decisions are blocked; alignment with strategic, launch, enterprise, or compliance priorities.",
    "recommendedAction": "Escalate the blocker, identify the decision owner, and unblock dependent work today."
  },
  {
    "id": "SR-002",
    "title": "Security review found exposed admin endpoint",
    "description": "The security team found an admin endpoint that is reachable without the expected network restriction. No exploit is confirmed, but the endpoint controls account-level settings.",
    "category": "security_risk",
    "impactScore": 4,
    "urgencyScore": 4,
    "riskScore": 5,
    "dependencyScore": 3,
    "strategicAlignmentScore": 4,
    "confidenceScore": 4,
    "overallImportanceScore": 81,
    "priorityLabel": "Act Now",
    "explanation": "Security review found exposed admin endpoint is labeled \"Act Now\" because its strongest drivers are risk, impact, urgency. Signals include security, compliance, failure, or downside risk; specific evidence is present.",
    "recommendedAction": "Assign an owner immediately, confirm mitigation steps, and review status today."
  },
  {
    "id": "SR-004",
    "title": "Requirement for enterprise SSO approval flow is unclear",
    "description": "The team does not know whether enterprise SSO requires admin approval, legal approval, or both. Engineering is estimating the work, but the acceptance criteria are incomplete.",
    "category": "unclear_requirement",
    "impactScore": 4,
    "urgencyScore": 4,
    "riskScore": 4,
    "dependencyScore": 4,
    "strategicAlignmentScore": 4,
    "confidenceScore": 1,
    "overallImportanceScore": 77,
    "priorityLabel": "Prioritize",
    "explanation": "Requirement for enterprise SSO approval flow is unclear is labeled \"Prioritize\" because its strongest drivers are impact, urgency, risk. Signals include broad customer, revenue, enterprise, billing, or production impact; time-sensitive language or near-term deadline; security, compliance, failure, or downside risk.",
    "recommendedAction": "Clarify missing details, then schedule prioritization in the next planning review."
  },
  {
    "id": "SR-005",
    "title": "Mobile sprint work blocked by design token mismatch",
    "description": "Mobile implementation is blocked because design tokens in Figma do not match the shared component library. Three stories are waiting on a decision from design systems.",
    "category": "blocked_work",
    "impactScore": 3,
    "urgencyScore": 4,
    "riskScore": 3,
    "dependencyScore": 5,
    "strategicAlignmentScore": 3,
    "confidenceScore": 4,
    "overallImportanceScore": 71,
    "priorityLabel": "Prioritize",
    "explanation": "Mobile sprint work blocked by design token mismatch is labeled \"Prioritize\" because its strongest drivers are dependency, urgency, confidence. Signals include other work, teams, or decisions are blocked.",
    "recommendedAction": "Plan action this week and track ownership, due date, and dependency status."
  },
  {
    "id": "SR-008",
    "title": "Update onboarding documentation screenshots",
    "description": "The onboarding guide still shows the old settings page. New screenshots should be added before the next customer enablement session.",
    "category": "documentation",
    "impactScore": 3,
    "urgencyScore": 2,
    "riskScore": 2,
    "dependencyScore": 2,
    "strategicAlignmentScore": 3,
    "confidenceScore": 4,
    "overallImportanceScore": 50,
    "priorityLabel": "Watch",
    "explanation": "Update onboarding documentation screenshots is labeled \"Watch\" because its strongest drivers are confidence, impact, strategic alignment. Signals include broad customer, revenue, enterprise, billing, or production impact.",
    "recommendedAction": "Monitor for changes and revisit if impact, urgency, or dependency signals increase."
  },
  {
    "id": "SR-012",
    "title": "Refactor settings page CSS",
    "description": "The settings page CSS has duplicated spacing rules. Refactoring would improve maintainability but does not block current roadmap work.",
    "category": "technical_debt",
    "impactScore": 2,
    "urgencyScore": 1,
    "riskScore": 2,
    "dependencyScore": 1,
    "strategicAlignmentScore": 2,
    "confidenceScore": 4,